{
  "schemaVersion": 1,
  "name": "spec",
  "graph": {
    "id": "01JSOMEOTHERGRAPH000000000",
    "specDigest": "sha256:0000000000000000000000000000000000000000000000000000000000000000"
  },
  "values": {
    "cutMax": 2
  },
  "note": "④ 规格变了：图 id 与摘要都和当前图不同；值本身合法，只提示、不阻止",
  "updatedAt": "2026-09-24T08:00:00.000Z"
}
